{
  "siteId": "boundary-waters-moose-lake",
  "source": "VNP46A4",
  "collectionVersion": "2",
  "radianceLayer": "AllAngle_Composite_Snow_Free",
  "qualityLayer": "AllAngle_Composite_Snow_Free_Quality",
  "units": "nW/cm2/sr",
  "blackMarbleYears": [
    2023,
    2024,
    2025
  ],
  "baselineOverrideUsed": false,
  "coverageOverrideUsed": false,
  "rings": [
    {
      "id": "0to2",
      "minKm": 0,
      "maxKm": 2,
      "upperInclusive": false,
      "statistic": "median",
      "alanWeight": 0.45,
      "radiance": 0,
      "coverage": 1,
      "years": [
        {
          "year": 2025,
          "radiance": 0,
          "coverage": 1,
          "validPixelCount": 86,
          "totalPixelCount": 86
        },
        {
          "year": 2024,
          "radiance": 0,
          "coverage": 1,
          "validPixelCount": 86,
          "totalPixelCount": 86
        },
        {
          "year": 2023,
          "radiance": 0,
          "coverage": 1,
          "validPixelCount": 86,
          "totalPixelCount": 86
        }
      ]
    },
    {
      "id": "2to10",
      "minKm": 2,
      "maxKm": 10,
      "upperInclusive": false,
      "statistic": "mean",
      "alanWeight": 0.3,
      "radiance": 0.000239,
      "coverage": 1,
      "years": [
        {
          "year": 2025,
          "radiance": 0,
          "coverage": 1,
          "validPixelCount": 2107,
          "totalPixelCount": 2107
        },
        {
          "year": 2024,
          "radiance": 0.000239,
          "coverage": 1,
          "validPixelCount": 2107,
          "totalPixelCount": 2107
        },
        {
          "year": 2023,
          "radiance": 0.000792,
          "coverage": 1,
          "validPixelCount": 2107,
          "totalPixelCount": 2107
        }
      ]
    },
    {
      "id": "10to30",
      "minKm": 10,
      "maxKm": 30,
      "upperInclusive": false,
      "statistic": "mean",
      "alanWeight": 0.15,
      "radiance": 0.028807,
      "coverage": 0.999886,
      "years": [
        {
          "year": 2025,
          "radiance": 0.028807,
          "coverage": 0.999886,
          "validPixelCount": 17479,
          "totalPixelCount": 17481
        },
        {
          "year": 2024,
          "radiance": 0.027187,
          "coverage": 0.999943,
          "validPixelCount": 17480,
          "totalPixelCount": 17481
        },
        {
          "year": 2023,
          "radiance": 0.03159,
          "coverage": 1,
          "validPixelCount": 17481,
          "totalPixelCount": 17481
        }
      ]
    },
    {
      "id": "30to75",
      "minKm": 30,
      "maxKm": 75,
      "upperInclusive": true,
      "statistic": "mean",
      "alanWeight": 0.1,
      "radiance": 0.015774,
      "coverage": 0.999807,
      "years": [
        {
          "year": 2025,
          "radiance": 0.015774,
          "coverage": 0.999807,
          "validPixelCount": 103358,
          "totalPixelCount": 103378
        },
        {
          "year": 2024,
          "radiance": 0.014864,
          "coverage": 0.999816,
          "validPixelCount": 103359,
          "totalPixelCount": 103378
        },
        {
          "year": 2023,
          "radiance": 0.019707,
          "coverage": 0.999874,
          "validPixelCount": 103365,
          "totalPixelCount": 103378
        }
      ]
    }
  ],
  "radiance0to2": 0,
  "radiance2to10": 0.000239,
  "radiance10to30": 0.028807,
  "radiance30to75": 0.015774,
  "alanExposure": 0.005897,
  "darknessScore": 92.98,
  "coverage": 0.999807,
  "warnings": [],
  "retrievedAt": "2026-09-17T11:18:13.362627Z"
}
